<?xml version="1.0"?>
<?xml-stylesheet type="text/xsl" href="story2html.xsl"?>
<!DOCTYPE story SYSTEM "story.dtd">
<story ignore="yes">
    <id>11</id>
    <original>
        Je jouais avec la pièce [sur le bureau] comme ça, et puis elle est tombée en
        plein milieu [de la poubelle vide]. Elle a fait comme ça [elle a roulé dans la
        poubelle, fait le geste], et puis elle est s'est arrêtée là.
    </original>
    
    <comment>pas sur de la garder</comment>
    
    <categories>
        <category>coincidence</category>
    </categories>
    
    <alternatives>
        <alt altid="1">
            <text>
                Je jouais avec une pièce sur le bureau. Elle a roulé sur le bureau,
                après elle est tombé dans la poubelle vide, elle a roulé encore à l'intérieur
                de la poubelle et puis elle est s'est arrêtée <ch>en plein milieu</ch>.
            </text>
        </alt>
        <alt altid="2">
            <text>
                Je jouais avec une pièce sur le bureau. Elle a roulé sur le bureau,
                après elle est tombé dans la poubelle vide, elle a roulé encore à l'intérieur
                de la poubelle et puis elle est s'est arrêtée<ch></ch>.
            </text>
        </alt>
    </alternatives>
</story>



